<?xml version="1.0" encoding="UTF-8" standalone="yes"?>
<Result xmlns="http://www.example.org/LogicalExpressions" xmlns:xsi="http://www.w3.org/2001/XMLSchema-instance" xsi:schemaLocation="http://www.example.org/LogicalExpressions LogicalExpressions.xsd">
    <TableSize>0</TableSize>
    <DataDriven>false</DataDriven>
    <IndirectNF>false</IndirectNF>
    <Node Name="n_0"/>
    <Node Name="n_1"/>
    <Node Name="n_EndHost"/>
    <Packet Name="p_0"/>
    <Packet Name="p_1"/>
    <Time Name="t_0"/>
    <Time Name="t_1"/>
    <LogicalExpressionResult>
        <Implies>
            <AntecedentExpression>
                <Send>
                    <Source>n_EndHost</Source>
                    <Destination>n_0</Destination>
                    <Packet_out>p_0</Packet_out>
                    <Time_out>t_0</Time_out>
                </Send>
            </AntecedentExpression>
            <ConsequentExpression>
                <Exist>
                    <Unit>n_1</Unit>
                    <Unit>p_1</Unit>
                    <Unit>t_1</Unit>
                    <Expression>
                        <And>
                            <Expression>
<Recv>
    <Source>n_1</Source>
    <Destination>n_EndHost</Destination>
    <Packet_in>p_1</Packet_in>
    <Time_in>t_1</Time_in>
</Recv>
                            </Expression>
                            <Expression>
<LessThan>
    <LeftExpression>
        <Param>t_1</Param>
    </LeftExpression>
    <RightExpression>
        <Param>t_0</Param>
    </RightExpression>
</LessThan>
                            </Expression>
                            <Expression>
<Equal>
    <LeftExpression>
        <FieldOf>
            <Unit>p_1</Unit>
            <Field>APPLICATION_PROTOCOL</Field>
        </FieldOf>
    </LeftExpression>
    <RightExpression>
        <Param>DNS_RESPONSE</Param>
    </RightExpression>
</Equal>
                            </Expression>
                            <Expression>
<Equal>
    <LeftExpression>
        <FieldOf>
            <Unit>p_0</Unit>
            <Field>IP_SRC</Field>
        </FieldOf>
    </LeftExpression>
    <RightExpression>
        <FieldOf>
            <Unit>p_1</Unit>
            <Field>IP_DST</Field>
        </FieldOf>
    </RightExpression>
</Equal>
                            </Expression>
                            <Expression>
<Equal>
    <LeftExpression>
        <FieldOf>
            <Unit>p_0</Unit>
            <Field>PORT_SRC</Field>
        </FieldOf>
    </LeftExpression>
    <RightExpression>
        <FieldOf>
            <Unit>p_1</Unit>
            <Field>PORT_DST</Field>
        </FieldOf>
    </RightExpression>
</Equal>
                            </Expression>
                            <Expression>
<Equal>
    <LeftExpression>
        <FieldOf>
            <Unit>p_0</Unit>
            <Field>IP_DST</Field>
        </FieldOf>
    </LeftExpression>
    <RightExpression>
        <FieldOf>
            <Unit>p_1</Unit>
            <Field>L7DATA</Field>
        </FieldOf>
    </RightExpression>
</Equal>
                            </Expression>
                            <Expression>
<Equal>
    <LeftExpression>
        <FieldOf>
            <Unit>p_0</Unit>
            <Field>PORT_DST</Field>
        </FieldOf>
    </LeftExpression>
    <RightExpression>
        <Param>HTTP_PORT_80</Param>
    </RightExpression>
</Equal>
                            </Expression>
                            <Expression>
<Equal>
    <LeftExpression>
        <FieldOf>
            <Unit>p_0</Unit>
            <Field>APPLICATION_PROTOCOL</Field>
        </FieldOf>
    </LeftExpression>
    <RightExpression>
        <Param>HTTP_REQUEST</Param>
    </RightExpression>
</Equal>
                            </Expression>
                            <Expression>
<Equal>
    <LeftExpression>
        <FieldOf>
            <Unit>p_0</Unit>
            <Field>L7DATA</Field>
        </FieldOf>
    </LeftExpression>
    <RightExpression>
        <Param>REQUESTED_URL</Param>
    </RightExpression>
</Equal>
                            </Expression>
                            <Expression>
<Equal>
    <LeftExpression>
        <FieldOf>
            <Unit>p_0</Unit>
            <Field>TRANSPORT_PROTOCOL</Field>
        </FieldOf>
    </LeftExpression>
    <RightExpression>
        <FieldOf>
            <Unit>p_1</Unit>
            <Field>TRANSPORT_PROTOCOL</Field>
        </FieldOf>
    </RightExpression>
</Equal>
                            </Expression>
                        </And>
                    </Expression>
                </Exist>
            </ConsequentExpression>
        </Implies>
    </LogicalExpressionResult>
    <LogicalExpressionResult>
        <And>
            <Expression>
                <Send>
                    <Source>n_EndHost</Source>
                    <Destination>n_0</Destination>
                    <Packet_out>p_0</Packet_out>
                    <Time_out>t_0</Time_out>
                </Send>
            </Expression>
            <Expression>
                <Equal>
                    <LeftExpression>
                        <FieldOf>
                            <Unit>p_0</Unit>
                            <Field>IP_SRC</Field>
                        </FieldOf>
                    </LeftExpression>
                    <RightExpression>
                        <Param>ip_EndHost</Param>
                    </RightExpression>
                </Equal>
            </Expression>
            <Expression>
                <Equal>
                    <LeftExpression>
                        <FieldOf>
                            <Unit>p_0</Unit>
                            <Field>PORT_SRC</Field>
                        </FieldOf>
                    </LeftExpression>
                    <RightExpression>
                        <Param>value_0</Param>
                    </RightExpression>
                </Equal>
            </Expression>
            <Expression>
                <Equal>
                    <LeftExpression>
                        <FieldOf>
                            <Unit>p_0</Unit>
                            <Field>IP_DST</Field>
                        </FieldOf>
                    </LeftExpression>
                    <RightExpression>
                        <Param>ip_Local_Dns</Param>
                    </RightExpression>
                </Equal>
            </Expression>
            <Expression>
                <Equal>
                    <LeftExpression>
                        <FieldOf>
                            <Unit>p_0</Unit>
                            <Field>PORT_DST</Field>
                        </FieldOf>
                    </LeftExpression>
                    <RightExpression>
                        <Param>DNS_PORT_53</Param>
                    </RightExpression>
                </Equal>
            </Expression>
            <Expression>
                <Equal>
                    <LeftExpression>
                        <FieldOf>
                            <Unit>p_0</Unit>
                            <Field>APPLICATION_PROTOCOL</Field>
                        </FieldOf>
                    </LeftExpression>
                    <RightExpression>
                        <Param>DNS_REQUEST</Param>
                    </RightExpression>
                </Equal>
            </Expression>
            <Expression>
                <Equal>
                    <LeftExpression>
                        <FieldOf>
                            <Unit>p_0</Unit>
                            <Field>L7DATA</Field>
                        </FieldOf>
                    </LeftExpression>
                    <RightExpression>
                        <Param>REQUESTED_URL</Param>
                    </RightExpression>
                </Equal>
            </Expression>
        </And>
    </LogicalExpressionResult>
</Result>
